<?xml version="1.0" encoding="utf-8"?>
<table xsi:schemaLocation="http://www.sa.dk/xmlns/siard/1.0/schema0/table1.xsd table1.xsd" xmlns="http://www.sa.dk/xmlns/siard/1.0/schema0/table1.xsd" xmlns:xsi="http://www.w3.org/2001/XMLSchema-instance">
	<row>
		<c1>1</c1>
		<c2>Helt eller delvis digitalt</c2>
	</row>
	<row>
		<c1>2</c1>
		<c2>Papir</c2>
	</row>
	<row>
		<c1>3</c1>
		<c2>Ikke relevant</c2>
	</row>
</table>